{
  "$schema": "./host-matrix.schema.json",
  "schemaVersion": "1.0.0",
  "revision": "2026-07-31",
  "hosts": {
    "vscode": {
      "name": "VS Code Insiders",
      "transport": ["http", "streamable-http"],
      "tls": true,
      "csp": {
        "script-src": "'self' 'unsafe-inline'",
        "unsafe-eval": false,
        "unsafe-inline": true,
        "connect-src": "self",
        "media-src": "self",
        "img-src": "permissive",
        "style-src": "'self' 'unsafe-inline'",
        "host-controlled-immutable": true,
        "honors-meta-ui-csp": false,
        "notes": "Policy is fixed by the host. _meta.ui.csp.connectDomains/resourceDomains are ignored; the iframe is sandbox='allow-scripts allow-same-origin' with no allow= for autoplay/microphone/camera."
      },
      "sandbox": {
        "microphone": false,
        "camera": false,
        "geolocation": false,
        "autoplay": false,
        "web-speech": false,
        "clipboard-write": "varies",
        "allow-same-origin": true,
        "populates-host-capabilities-permissions": false,
        "notes": "A direct-user-gesture PNG ClipboardItem write succeeded in the validated build even though hostCapabilities.sandbox.permissions was absent. Feature-detect the browser API, catch rejection and retain a fallback; do not infer background or unrestricted clipboard access."
      },
      "server-initiated": {
        "sampling": true,
        "sampling-requirements": [
          "stateful-or-bidirectional-transport",
          "per-server-authorization:allowedOutsideChat-for-app-ui",
          "display-frame-fallback"
        ],
        "elicitation": "unvalidated",
        "resource-subscriptions": "unvalidated",
        "requires-stateful-transport": true,
        "notes": "VS Code negotiates a session and supports sampling/createMessage. Three gates are independent: stateful transport, advertised sampling capability, and per-server authorization through chat.mcp.serverSampling. MCP App UI actions are outside-chat sampling and require allowedOutsideChat=true for the exact server entry. Direct-chat authorization was not part of this probe. Without authorization the host may return stopReason=cancelled even though sampling was advertised. Reload/reconnect after changing policy. Elicitation/subscriptions not yet validated firsthand."
      },
      "secure-context": true,
      "iframe-origin": "vscode-webview://",
      "features": {
        "canvas-2d": true,
        "webgl": true,
        "web-workers": true,
        "websockets": true,
        "fetch-localhost": true,
        "fetch-external": false,
        "external-media-src": false,
        "media-autoplay": false,
        "web-speech-synthesis": false,
        "nested-iframes": false,
        "eval": false,
        "new-function": false,
        "cdn-script-tags": false,
        "cdn-link-tags": false,
        "dynamic-import": false,
        "window-open": false,
        "clipboard-image-write": true,
        "message-image-capability-advertised": false,
        "ui-message-image": "unvalidated"
      },
      "bundling": {
        "requires-singlefile": true,
        "npm-bundled-ok": true,
        "cdn-external-ok": false,
        "notes": "vite-plugin-singlefile inlines all JS/CSS into one HTML. External <script src> and <link href> to CDNs are blocked by CSP."
      },
      "known-broken-patterns": [
        "Map/geo SDKs that load their script from a vendor CDN and fetch tiles or assets from vendor domains at runtime (CDN script tag + connect-src both blocked)",
        "GL/worker-based renderers that compile styles via eval or bootstrap worker scripts through blob + eval",
        "MVVM/templating libraries that compile data-binding strings via new Function() (string-to-code)",
        "Frameworks with eval-based template compilation",
        "Media apps that point <audio>/<video> at external URLs or rely on autoplay/speechSynthesis (media-src 'self', no autoplay/web-speech grant) \u2014 proxy media bytes through the server instead"
      ],
      "known-working-patterns": [
        "npm-bundled rendering libraries that draw to canvas/WebGL/SVG with no string-to-code (e.g. canvas chart libs, data-driven 3D)",
        "map libraries whose tiles load as <img> elements (img-src is permissive) and that npm-bundle cleanly",
        "web-component / view libraries that template without eval or new Function()",
        "Media played through a host-approved same-origin resource or host-mediated player, triggered by a user gesture",
        "PNG bitmap copied with navigator.clipboard.write + ClipboardItem inside a direct user gesture, with a text/path fallback"
      ],
      "last-validated": "2026-07-31",
      "evidence": [
        {
          "kind": "empirical",
          "date": "2026-06-17",
          "source": "evidence/vscode-2026-06.md",
          "summary": "Validated CSP, sandbox, media, permissions and sampling behavior in VS Code Insiders."
        },
        {
          "kind": "empirical",
          "date": "2026-07-24",
          "source": "evidence/vscode-2026-07.md",
          "summary": "Validated direct-user-gesture PNG ClipboardItem writes; runtime sandbox permission metadata remained absent and direct app-to-chat image messaging remained unvalidated."
        },
        {
          "kind": "empirical",
          "date": "2026-07-31",
          "source": "evidence/vscode-2026-07.md",
          "summary": "Validated outside-chat sampling authorization for an MCP App UI action, including cancellation behavior when the exact per-server grant is absent."
        }
      ]
    },
    "apphub": {
      "name": "AppHub (custom MCP host)",
      "transport": ["http", "streamable-http"],
      "tls": true,
      "csp": {
        "unsafe-eval": true,
        "unsafe-inline": true,
        "connect-src": "*"
      },
      "sandbox": {
        "microphone": true,
        "camera": true,
        "geolocation": true,
        "clipboard-write": true,
        "allow-same-origin": true
      },
      "server-initiated": {
        "sampling": true,
        "sampling-requirements": [
          "stateful-or-bidirectional-transport",
          "host-sampling-handler",
          "display-frame-fallback"
        ],
        "elicitation": false,
        "resource-subscriptions": "unvalidated",
        "requires-stateful-transport": true,
        "notes": "AppHub fulfils sampling/createMessage by bridging to its own agent SDK; its MCP client declares capabilities.sampling and answers CreateMessageRequestSchema. Downstream servers must still use a stateful transport. Elicitation not yet implemented."
      },
      "secure-context": true,
      "iframe-origin": "about:srcdoc",
      "features": {
        "canvas-2d": true,
        "webgl": true,
        "web-workers": true,
        "websockets": true,
        "fetch-localhost": true,
        "fetch-external": true,
        "external-media-src": true,
        "media-autoplay": "unvalidated",
        "web-speech-synthesis": true,
        "nested-iframes": true,
        "eval": true,
        "new-function": true,
        "cdn-script-tags": true,
        "cdn-link-tags": true,
        "dynamic-import": true,
        "window-open": true,
        "clipboard-image-write": "unvalidated",
        "message-image-capability-advertised": "unvalidated",
        "ui-message-image": "unvalidated"
      },
      "bundling": {
        "requires-singlefile": false,
        "npm-bundled-ok": true,
        "cdn-external-ok": true,
        "notes": "Full browser environment. Minimal sandbox. Both bundled and CDN approaches work."
      },
      "known-broken-patterns": [],
      "known-working-patterns": [
        "Reviewed first-party apps using capabilities explicitly granted by the host"
      ],
      "last-validated": "2026-04-05",
      "evidence": [
        {
          "kind": "empirical",
          "date": "2026-04-05",
          "source": "evidence/custom-hosts-2026-06.md",
          "summary": "Validated against the first-party AppHub custom host."
        }
      ]
    },
    "standalone": {
      "name": "basic-host (ext-apps reference)",
      "transport": ["http", "streamable-http"],
      "tls": false,
      "csp": {
        "unsafe-eval": true,
        "unsafe-inline": true,
        "connect-src": "*"
      },
      "sandbox": {
        "microphone": true,
        "camera": true,
        "geolocation": true,
        "clipboard-write": true,
        "allow-same-origin": true
      },
      "server-initiated": {
        "sampling": "unvalidated",
        "sampling-requirements": [
          "host-validation",
          "stateful-or-bidirectional-transport",
          "display-frame-fallback"
        ],
        "elicitation": "unvalidated",
        "resource-subscriptions": "unvalidated",
        "requires-stateful-transport": true,
        "notes": "basic-host capability for server-initiated requests not validated firsthand. Treat as unavailable until probed (see sampling.md cross-host validation). Validate over stdio, which is inherently bidirectional."
      },
      "secure-context": false,
      "iframe-origin": "about:srcdoc",
      "features": {
        "canvas-2d": true,
        "webgl": true,
        "web-workers": true,
        "websockets": true,
        "fetch-localhost": true,
        "fetch-external": true,
        "external-media-src": true,
        "media-autoplay": "unvalidated",
        "web-speech-synthesis": true,
        "nested-iframes": true,
        "eval": true,
        "new-function": true,
        "cdn-script-tags": true,
        "cdn-link-tags": true,
        "dynamic-import": true,
        "window-open": true,
        "clipboard-image-write": "unvalidated",
        "message-image-capability-advertised": "unvalidated",
        "ui-message-image": "unvalidated"
      },
      "bundling": {
        "requires-singlefile": false,
        "npm-bundled-ok": true,
        "cdn-external-ok": true,